{
  "$schema": "https://json-schema.org/draft/2020-12/schema",
  "$id": "https://raw.githubusercontent.com/realmadede/macKali/master/extensions/manifest-schema.json",
  "title": "GNOME Extension Manifest Schema",
  "description": "Schema for validating GNOME extension compatibility metadata, installation methods, and presets in macKali.",
  "type": "object",
  "required": [
    "name",
    "uuid",
    "uuid_verified",
    "official_source",
    "supported_gnome_versions",
    "versions_verified",
    "installation_method",
    "enabled_presets",
    "known_conflicts",
    "installation_status",
    "unverified_fields"
  ],
  "properties": {
    "name": {
      "type": "string",
      "description": "Human-readable extension name."
    },
    "uuid": {
      "type": "string",
      "description": "Verified unique extension identifier (UUID) matching metadata.json."
    },
    "uuid_verified": {
      "type": "boolean",
      "description": "True if UUID has been validated against official upstream repository or extensions.gnome.org."
    },
    "official_source": {
      "type": "object",
      "required": ["repository", "gnome_extensions_url"],
      "properties": {
        "repository": {
          "type": "string",
          "format": "uri",
          "description": "URL of upstream source repository (e.g. GitHub, GitLab)."
        },
        "gnome_extensions_url": {
          "type": "string",
          "format": "uri",
          "description": "URL on extensions.gnome.org."
        },
        "author": {
          "type": "string",
          "description": "Original author or maintainer."
        }
      }
    },
    "supported_gnome_versions": {
      "type": "array",
      "items": {
        "type": "string"
      },
      "description": "GNOME Shell major versions supported by upstream metadata."
    },
    "versions_verified": {
      "type": "boolean",
      "description": "True if compatibility has been verified against upstream metadata.json."
    },
    "installation_method": {
      "type": "string",
      "enum": [
        "package_manager",
        "gnome_extensions_cli",
        "git_build",
        "zip_release",
        "manual"
      ],
      "description": "Mechanism used to download and install extension."
    },
    "enabled_presets": {
      "type": "array",
      "items": {
        "type": "string",
        "enum": ["minimal", "balanced", "full"]
      },
      "description": "macKali installation presets where this extension is activated."
    },
    "settings_schema": {
      "type": "string",
      "description": "GSettings schema ID used for configuring extension settings."
    },
    "known_conflicts": {
      "type": "array",
      "items": {
        "type": "string"
      },
      "description": "List of conflicting extension UUIDs or desktop components."
    },
    "installation_status": {
      "type": "string",
      "enum": [
        "not_installed",
        "installed",
        "incompatible",
        "planned"
      ],
      "description": "Current tracking status. In Phase 1, all extensions are marked 'planned'."
    },
    "notes": {
      "type": "string",
      "description": "Operational notes, workarounds, or configuration hints."
    },
    "unverified_fields": {
      "type": "array",
      "items": {
        "type": "string"
      },
      "description": "List of any fields requiring further manual or automated verification."
    },
    "license": {
      "type": "string",
      "description": "Software license of the upstream extension."
    },
    "wayland_compatible": {
      "type": "boolean",
      "description": "Whether the extension has been verified operational on GNOME Wayland sessions."
    },
    "ego_pk": {
      "type": "integer",
      "description": "Numeric extension ID on extensions.gnome.org."
    },
    "ego_version": {
      "type": "integer",
      "description": "Verified release version number on extensions.gnome.org for target GNOME."
    },
    "ego_download_tag": {
      "type": "integer",
      "description": "Download tag ID for the verified release artifact on extensions.gnome.org."
    },
    "dconf_path": {
      "type": "string",
      "description": "Dconf path prefix for extension configuration."
    },
    "tested_gnome_versions": {
      "type": "array",
      "items": {
        "type": "string"
      },
      "description": "GNOME Shell major versions explicitly tested and verified in macKali test suite."
    },
    "min_gnome_version": {
      "type": "string",
      "description": "Minimum GNOME Shell major version required by upstream extension."
    }
  },
  "additionalProperties": false
}
