{
  "name": "Blur my Shell",
  "uuid": "blur-my-shell@aunetx",
  "uuid_verified": true,
  "official_source": {
    "repository": "https://github.com/aunetx/blur-my-shell",
    "gnome_extensions_url": "https://extensions.gnome.org/extension/3193/blur-my-shell/",
    "author": "aunetx"
  },
  "supported_gnome_versions": [
    "46",
    "47",
    "48",
    "49",
    "50",
    "51"
  ],
  "versions_verified": true,
  "installation_method": "gnome_extensions_cli",
  "enabled_presets": [
    "balanced",
    "full"
  ],
  "settings_schema": "org.gnome.shell.extensions.blur-my-shell",
  "known_conflicts": [
    "dash-to-dock corner radius styling conflict (requires corner radius matching in settings)"
  ],
  "installation_status": "planned",
  "notes": "Essential macOS frosted glass background effect for top panel, dash dock, and application overview.",
  "unverified_fields": []
}
