{
  "name": "Compiz windows effect",
  "uuid": "compiz-windows-effect@hermes83.github.com",
  "uuid_verified": true,
  "official_source": {
    "repository": "https://github.com/hermes83/compiz-windows-effect",
    "gnome_extensions_url": "https://extensions.gnome.org/extension/3210/compiz-windows-effect/",
    "author": "hermes83"
  },
  "supported_gnome_versions": [
    "49",
    "50",
    "51"
  ],
  "versions_verified": true,
  "installation_method": "gnome_extensions_cli",
  "enabled_presets": [
    "full"
  ],
  "settings_schema": "org.gnome.shell.extensions.com.github.hermes83.compiz-windows-effect",
  "known_conflicts": [
    "burn-my-windows@schneegans.github.com",
    "wobbly-windows@hermes83.github.com"
  ],
  "installation_status": "planned",
  "license": "GPL-3.0-or-later",
  "wayland_compatible": true,
  "ego_pk": 3210,
  "ego_version": 33,
  "ego_download_tag": 76121,
  "dconf_path": "/org/gnome/shell/extensions/com/github/hermes83/compiz-windows-effect/",
  "min_gnome_version": "49",
  "tested_gnome_versions": [
    "50"
  ],
  "notes": "Upstream master branch targets GNOME 49-51. For GNOME 45-48, specific release tags or older zips from extensions.gnome.org must be installed.",
  "unverified_fields": []
}
